{
  "$schema": "https://json-schema.org/draft/2020-12/schema",
  "type": "object",
  "properties": {
    "title": {
      "type": "string"
    },
    "slug": {
      "type": "string"
    },
    "city": {
      "type": "string"
    },
    "employmentType": {
      "type": "string"
    },
    "salary": {
      "type": "string"
    },
    "shortDescription": {
      "type": "string"
    },
    "responsibilities": {
      "type": "array",
      "items": {
        "type": "string"
      }
    },
    "requirements": {
      "type": "array",
      "items": {
        "type": "string"
      }
    },
    "conditions": {
      "type": "array",
      "items": {
        "type": "string"
      }
    },
    "order": {
      "type": "number"
    },
    "isActive": {
      "type": "boolean"
    },
    "seoTitle": {
      "type": "string"
    },
    "seoDescription": {
      "type": "string"
    },
    "$schema": {
      "type": "string"
    }
  },
  "required": [
    "title",
    "slug",
    "city",
    "employmentType",
    "salary",
    "shortDescription",
    "responsibilities",
    "requirements",
    "conditions",
    "order",
    "isActive",
    "seoTitle",
    "seoDescription"
  ],
  "additionalProperties": false
}