{
  "title": "Сварщик металлоконструкций",
  "slug": "svarshchik-metallokonstruktsiy",
  "city": "Курган",
  "employmentType": "Полная занятость",
  "salary": "По результатам собеседования",
  "shortDescription": "Изготовление металлоконструкций в цехе СМУ-1.",
  "seoTitle": "Сварщик металлоконструкций — вакансия СМУ-1",
  "seoDescription": "Изготовление металлоконструкций в цехе СМУ-1.",
  "responsibilities": [
    "Сварка металлоконструкций по чертежам",
    "Подготовка и сборка узлов",
    "Контроль качества сварных швов"
  ],
  "requirements": [
    "Опыт работы со сваркой металла",
    "Умение читать чертежи",
    "Ответственность и аккуратность"
  ],
  "conditions": [
    "Стабильная загрузка производства",
    "Оформление по договоренности",
    "Работа в городе Курган"
  ],
  "order": 1,
  "isActive": true
}
